ids,instructions,Verbs
8bd79a4b9d,Add the well pureed beans to the the pan with the kanten liquid.,add
8bd79a4b9d,"Add the remaining water to the blender, rinse out the bean puree sticking to the sides and pour into the pan.","add,rinse,pour"
8bd79a4b9d,This was the reason for reserving some of the water.,reseving
8bd79a4b9d,All the ingredients are in the pan now.,none
8bd79a4b9d,They will now be poured into the mold.,poured
8bd79a4b9d,"When the mixture has cooled down enough to refrigerate, put it in the refrigerator to chill and set completely.","cooled,chill,set"
8bd79a4b9d,"Since the ingredients are not heated, it should cool down right away.",cool
0ea4120573,Place lamb in a bowl and drizzle 2 teaspoons olive oil over lamb,drizzle
0ea4120573,stir until coated.,stir
0ea4120573,Heat remaining 2 teaspoons olive oil in a saucepan over low heat,"heat,low heat"
0ea4120573," cook and stir onion until softened, 10 to 15 minutes.","cook,stir"
0ea4120573,Remove saucepan from heat and add potato to onion.,"remove,add"
0ea4120573,Heat a large skillet over medium heat,heat
0ea4120573," cook and stir lamb, working in small batches, until browned, about 5 minutes per batch.","cook,stir"
0ea4120573,Transfer browned lamb to onion mixture.,transfer
0ea4120573,Stir curry into lamb-onion mixture and cook over medium heat for 1 minute.,stir
0ea4120573,Add water to lamb-onion mixture and bring to a boil.,"add,boil"
0ea4120573,"Reduce heat to low, cover saucepan, and simmer until lamb is cooked through and potatoes are tender, about 45 minutes.","reduce,cover,simmer"
0ea4120573,"Mix coconut milk and chickpeas into lamb-onion mixture and simmer until heated through, about 5 minutes.","mix,simmer"
8a9222354b,"Juice the lemon into a bowl, stir in cumin.","juice,stir"
8a9222354b,Drain the niblet corn.,drain
8a9222354b,"Add corn, red pepper, jalepeno peper and onion to the bowl with the lemon and cumin.",add
8a9222354b,Mix.,mix
8a9222354b,"Fold in avocado, carefully so as not to mush it with the other ingredients.",fold
8a9222354b,Let sit for minimum one hour before serving.,sit
8a9222354b,Enjoy.,none
576be871b2,"Slice radishes thinly, a mandolin is very helpful.",Slice
576be871b2,Liberally slather sliced bread with the unsalted butter and layer with the radishes.,"slather,layer"
576be871b2,"Sprinkle with sea salt (chopped chives are lovely, too) and serve.","sprinkle,serve"
576be871b2,Enjoy!,none
a8b92f2969,Pour the packet of active dry yeast into lukewarm water and whisk with a fork until the yeast is dissolved.,"pour,whisk"
a8b92f2969,Let sit for about 10 minutes to activate the yeast.,sit
a8b92f2969,Combine flour and salt in a large bowl and form a well in the center of the flour.,combine
a8b92f2969,"Pour the water into the well and, using your hands or the dough hook on an electric mixer (not a beater!",pour
a8b92f2969,"), mix the flour and the water together.",mix
a8b92f2969,"When combined, transfer half of the dough to a floured surface and knead until the dough is smooth and elastic, not sticky.","transfer,knead"
a8b92f2969,Repeat with the second half of the dough.,repeat
a8b92f2969,"If using immediately, place the balls of dough in a bowl.",place
a8b92f2969,"If not using immediately, the dough can be placed in a plastic bag or Tupperware container in the refrigerator for 48 hours or frozen.",placed
a8b92f2969,Do not leave uncovered if placing in the fridge or freezer.,none
a8b92f2969,(Adapted from The Kitchn.),none
6e15387091,"Put the water, pure cocoa powder and sugar into a mug and mix.","put,mix"
6e15387091,Microwave it for 30 seconds.,microwave
6e15387091,"Add the milk /soy milk, and microwave for a further 1 minute 30 seconds.","add,microwave"
6e15387091,Add some vanilla essence to finish.,add
6e15387091,"You can make your own variations - try it topped with whipped cream, marshmallows, or with frothy cappuccino-style milk.",topped
fe45f57b4e,Wash wheat in cold water and soak overnight in the 3 to 4 quarts of water.,"wash,soak"
fe45f57b4e,"The next day, bring the water to a boil then simmer for 4 to 5 hours, stirring occasionally to prevent sticking.","boil,simmer,stirring"
fe45f57b4e,The wheat is ready when the kernels burst open and the fluid is thick and creamy.,none
fe45f57b4e,Chop the poppy seed in a food processor (or coffee grinder) (or you can buy ground poppy seeds in some deli's) and set aside.,chop
fe45f57b4e,"Mix honey, sugar and hot water.",mix
fe45f57b4e,"Mix the honey mixture, poppy seeds, and chopped nuts and wheat.",mix
fe45f57b4e,More honey can be added to taste.,added
fe45f57b4e,Keep in refrigerator.,keep
fede91794e,"Boil the shirataki mushrooms in hot water with a little less than 1/4 teaspoon salt, and skim out he scum (if you're not in a hurry, saute in a frying pan until they sizzle to increase the Yang element).","boil,skim,saute"
fede91794e,Cut the veggies into bite-sizes.,cut
fede91794e,"Add the shiitake from Step 1 to the rice cooker along with the kombu, daikon radish, potatoes, burdock root, carrots, lotus root, oden ingredients, and flavoring broth, and switch on the rice cooker!","add,switch on"
fede91794e,Add the ingredients that fall apart easily such as the mochi kinchaku (rice cakes in aburaage) after the rice cooking mode has finished and switches over to warming mode (about 30 minutes prior to serving) to let the flavors absorb.,add
fede91794e,Use the leftover broth to make Stewed Okaraor use it to cook rice.,cook
fede91794e,Give it a try!,none
d5a9a8d1f7,Place cranberries in small bowl,place
d5a9a8d1f7,cover with boiling water.,cover
d5a9a8d1f7,Let stand 10 min.,stand
d5a9a8d1f7,"Meanwhile, place pizza crust on baking sheet.",place
d5a9a8d1f7,Beat next 3 ingredients with mixer until well blended,beat
d5a9a8d1f7,spread onto crust.,spread
d5a9a8d1f7,Drain cranberries.,drain
d5a9a8d1f7,Arrange pear and kiwi slices over pizza,arrange
d5a9a8d1f7,top with cranberries and nuts.,topped
d5a9a8d1f7,Bake 10 min.,bake
d5a9a8d1f7,or until heated through.,none
d5a9a8d1f7,Serve warm.,serve
c246166eaa,"Thinly slice the pineapple into rounds, then cut the rounds into quarters.","slice,cut"
c246166eaa,Place them in a large nonreactive bowl.,place
c246166eaa,Add the lemons and brandy and stir to combine.,"add,stir"
c246166eaa,Let sit at room temperature while you make the tea mixture.,sit
c246166eaa,"Combine the sugar and water in a small saucepan and bring to a boil over medium-high heat, stirring to dissolve the sugar.","combine,boil,stirring"
c246166eaa,"Remove from the heat, add the tea leaves, and stir to combine.","remove,add,stir"
c246166eaa,"Set aside to cool to room temperature, about 1 hour.","set aside,cool"
c246166eaa,"Hold a fine-mesh strainer over the bowl with the pineapple-lemon mixture and strain the tea mixture into the bowl (if there are large flecks of tea leaves, line the strainer with a coffee filter before straining).","hold,strain,line"
c246166eaa,"Cover the bowl and refrigerate until chilled, about 3 hours.","cover,refrigerate"
c246166eaa,"When ready to serve, transfer the fruit-brandy mixture to a 7-quart punch or serving bowl.",transfer
c246166eaa,"Gently stir in the sparkling wine, club soda, and rum (do not overmix or your punch will be flat).",stir
c246166eaa,Float the ice block in the punch and serve immediately.,float
2846553624,Heat oven to 400F degrees.,heat
2846553624,Grease cookie sheet.,grease
2846553624,Cut each biscuit in half.,cut
2846553624,"Roll into pencil shape, about 6 inch long.",roll
2846553624,"Place on sheet, brush with egg white.","place,brush"
2846553624,Sprinkle with salt.,sprinkle
2846553624,Bake for 12 to 15 minutes until golden brown.,bake
1b62ab3630,Melt the chocolate in the microwave or over a double boiler.,melt
1b62ab3630,Mix in the peppermint red and green crunch to taste.,mix
1b62ab3630,Spread on a waxed-paper-covered cookie sheet and allow to cool (or chill in the fridge or freezer for a faster set).,"spread,cool"
1b62ab3630,"Hand out to friends, neighbors, and coworkers.",none
1b62ab3630,Wait for the accolades to come rolling in.,none
1b62ab3630,"Note: you can substitute crunched-up candy canes for the peppermint crunch, but it will not taste as good.",substitute
1b62ab3630,These are a candy-making product that you can order from the internet (one brand is C&K products) or find in a particularly useful candy or craft shop.,none
1b62ab3630,"Please put in the effort to get the real stuff, it is worth it!",none
1b62ab3630,Merry Christmas!,none
a3a5034651,In the food procesor Grind the cauliflower to rice size or chop it to rice size,"Grind,chop"
a3a5034651,Saute for 1 min the cauliflower with the butter add bouillon or all spice salt and pepper to taste,"saute,add"
a3a5034651,Add just enough water to simmer so the cauliflower can be fully cooked but no water remaining when served.,"add,simmer"
a3a5034651,If you have too much water just drain the excess and adjust seasoning with a little more butter and seasoning.,"drain,adjust"
a3a5034651,You can experiment with the cauliflower adjusting how Cooked you like it either well done or a little bit crunchy.,adjust
354152850,"Brown meat in enough oil to keep meat from sticking, about 5 minutes",brown
354152850,drain fat.,drain
354152850,"Add onions, celery, carrots, and cook another 5 minutes, stirring occasionally.","add,cook,stirring"
354152850,"Add tomatoes, salt, oregano, pepper, and garlic powder (all seasonings to taste).",add
354152850,"Bring sauce to a boil, then lower the heat, cover, and let simmer for 1 hour.","boil,lower,simmer"
354152850,"Meanwhile, cook your pasta,timing it so that it is ready when the sauce has finished simmering.",cook
354152850,"Mix pasta, sauce and spinach all together, then pour into 2 greased 9x13"" casseroles.","mix,pour"
354152850,"Sprinkle each casserole with Parmesan cheese and bake at 350 F for about 30 minutes, or until bubbly (uncovered).","sprinkle,bake"
ecdbaf5479,Shake first three ingredients together with ice and strain into a highball glass half filled with cubed ice.,"shake,strain"
ecdbaf5479,Top up with pineapple juice.,top up
84144a6ddd,Mix wafer crumbs and butter until blended,mix
84144a6ddd,press onto bottom and up side of 9-inch tart pan with removable bottom.,press
84144a6ddd,Freeze while preparing filling.,freeze
84144a6ddd,Beat cream cheese and sugar in large bowl with mixer until blended.,beat
84144a6ddd,Gently stir in COOL WHIP,stir
84144a6ddd,spoon into crust.,spoon
84144a6ddd,Top with berries.,top
84144a6ddd,Refrigerate until ready to use.,refrigerate
84144a6ddd,Add boiling water to gelatin mix in medium bowl,"add,mix"
84144a6ddd,stir 2 min.,stir
84144a6ddd,until completely dissolved.,none
84144a6ddd,Add ice,add
84144a6ddd,stir until melted.,stir
84144a6ddd,Refrigerate 15 min.,refrigerate
84144a6ddd,or until slightly thickened.,none
84144a6ddd,Spoon gelatin over fruit in pan.,spoon
84144a6ddd,Refrigerate 3 hours or until firm.,refrigerate
780362af6e,Preheat the oven to 500.,preheat
780362af6e,Preheat a pizza stone or generously oil a large baking sheet.,preheat
780362af6e,"In a large skillet, cook the bacon over high heat until browned and most of the fat is rendered, about 6 minutes.",cook
780362af6e,"Drain on paper towels and let cool, then break the bacon into 1-inch pieces.","drain,cool,break"
780362af6e,Pour off all but 1 tablespoon of the bacon fat from the skillet and heat until shimmering.,"pour,heat"
780362af6e,"In a large heatproof bowl, toss the Swiss chard with the hot fat.",toss
780362af6e,"Add the bacon and half of the cheese, season with salt and pepper and toss well.","add,season,toss"
780362af6e,"On a lightly floured surface, roll the dough to a rough 14-inch round.",roll
780362af6e,"Transfer it to a floured pizza peel or rimless cookie sheet, or to the oiled baking sheet.",transfer
780362af6e,"Spoon the Swiss chard topping over the pizza, leaving a 1-inch border of dough.",spoon
780362af6e,Brush the border with the olive oil.,brush
780362af6e,Scatter the remaining cheese on top.,scatter
780362af6e,"Slide the pizza onto the hot stone, if using, and bake for about 10 minutes on the stone or 16 minutes on the baking sheet, until the crust is golden and the cheese is bubbling.","slide,bake"
780362af6e,Transfer the pizza to a rack and let cool slightly before serving.,"transfer,cool"
a4ec19e6b2,Heat oven to 350 degrees F.,heat
a4ec19e6b2,Prepare Dinner as directed on package.,prepare
a4ec19e6b2,Add all remaining ingredients except shredded cheese,add
a4ec19e6b2,mix well.,mix
a4ec19e6b2,Spoon into 8-inch square baking dish sprayed with cooking spray,spoon
a4ec19e6b2,top with shredded cheese.,top
a4ec19e6b2,Bake 20 to 25 min.,bake
a4ec19e6b2,or until heated through.,none
c6f6ca7a6a,Put the kale into a mixing bowl.,put
c6f6ca7a6a,"Add the olive oil, sea salt and juice of the lemon.",add
c6f6ca7a6a,"With your hands, massage them all together until kale is fully covered.",massage
c6f6ca7a6a,Add the cranberries and almonds into the mixture and toss to combine.,"add,toss"
c6f6ca7a6a,Tip: This will last 3 days in the fridge.,none
a761904917,Heat the oven to 170 degrees F and arrange a rack in the middle.,heat
a761904917,Line a rimmed baking sheet with a silicone baking mat and place on a flat work surface,"line,place"
a761904917,set aside.,set aside
a761904917,Set a fine-mesh strainer over a medium bowl,set
a761904917,set aside.,set aside
a761904917,"Place all of the ingredients in a blender and blend on high until youve got a very smooth puree, about 1 minute.","place,blend"
a761904917,"Pour the mixture through the strainer into the bowl, and then scrape a rubber spatula against the inside surface of the strainer to push the puree through until only seeds remain.","pour,scrape"
a761904917,Remove the strainer and discard the seeds.,"remove,discard"
a761904917,Transfer the puree to a container with a spout or return it to the cleaned and dried blender pitcher.,"transfer,return"
a761904917,"Slowly pour the puree onto the baking mat, tracing the inside of the colored border to create a rectangle.","pour,tracing"
a761904917,"(If your baking mat has no border, leave a 1-inch border from the edge.)",none
a761904917,Pour the remaining puree within the borders of the rectangle in a zigzag pattern (do not pour it all into the middle of the baking mat).,pour
a761904917,"Using the rubber spatula, push the puree to cover any empty parts within the rectangle (the surface will not be even).",push
a761904917,"Keeping the baking sheet on the work surface, grasp the edges of the sheetpressing against the exposed border of the baking mat with your thumbsand gently shake back and forth to even out the surface of the puree, rotating the baking sheet and shaking as necessary.","grasp,shake"
a761904917,"Place in the oven and bake until the surface of the fruit leather is slightly sticky to the touch but, when pressed in several different places, a finger does not leave an indentation, about 6 to 7 hours.","place,bake,pressed"
a761904917,"Remove the baking sheet from the oven, place on a wire rack, and let cool completely.","remove,place"
a761904917,Set aside a 16-inch-long sheet of waxed or parchment paper.,set aside
a761904917,"Starting at one short edge of the cooled fruit leather, pull it up from the baking mat and transfer it to the paper.","pull,transfer"
a761904917,"Using clean kitchen scissors, cut through the fruit leather and paper to form desired-sized strips, shapes, or pieces and roll up, paper and all (to prevent sticking).",cut
a761904917,Store in an airtight container for up to 3 weeks.,store
e90915e91f,Preheat oven to 350 degrees F (175 degrees C).,preheat
e90915e91f,"Mix together the bread crumbs, Parmesan cheese, garlic, black pepper, salt, seafood seasoning, and parsley in a shallow bowl.",mix
e90915e91f,Beat the eggs in a separate shallow bowl.,beat
e90915e91f,Heat the vegetable oil in a large skillet over medium heat.,heat
e90915e91f,"Dip fish fillets in the egg, then the crumbs",dip
e90915e91f,brush off any loose crumb mix.,brush
e90915e91f,"Sprinkle fillets with paprika, and cook in the hot oil until golden brown, about 5 minutes per side.","sprinkle,cook"
e90915e91f,Transfer the fish fillets to a 9x13-inch baking dish.,transfer
e90915e91f,"Cook and stir the onions and green bell peppers in the hot skillet until the onions are tender and translucent, about 10 minutes","cook,stir"
e90915e91f," spoon away any excess oil, and stir in the tomatoes.","spoon,stir"
e90915e91f,"Bring the vegetables to a boil, and spread them over the fish.","boil,spread"
e90915e91f,Cover the dish with foil.,cover
e90915e91f,"Bake in the preheated oven until hot and bubbling, about 30 minutes",bake
e90915e91f," remove foil, and spread Monterey Jack cheese over the fish and vegetables.","remove,spread"
e90915e91f,"Return to oven, and bake until the cheese is melted and beginning to brown, 8 to 10 more minutes.",bake
73a914a78b,"Put the sunflower oil into a saucepan to warm over a medium heat, meanwhile peel and chop the onion.","warm,peel,chop"
73a914a78b,Put the onion into the saucepan and soften over a low heat,"put,soften"
73a914a78b,Peel and dice the carrots and add to the saucepan.,"peel,dice,add"
73a914a78b,"Chop the celery and add it to the saucepan too, stirring and continuing to cook over a low heat as the vegetables soften","chop,add,stirring,cook,low heat"
73a914a78b,"Slice the chorizo and add to the pan with the vegetables, continue to cook over a low heat, cooking the chorizo and stirring as it releases its goodness","slice,add,stirring,low heat"
73a914a78b,When the vegetables are soft add the chopped tomatoes.,add
73a914a78b,Fill the can with water and add this to the pan as well,"fill,add"
73a914a78b,"Stir gently and increase the heat until the mixture comes to the boil, then reduce to a simmer","stir,heat,boil,simmer"
73a914a78b,Drain and rinse the beans and then add to the pan.,"drain,rinse,add"
73a914a78b,Season with salt and pepper to taste and stir through a pinch of basil (or other herbs of your choosing).,"season,stir"
73a914a78b,Simmer for another few minutes and then serve!,simmer
73a914a78b,"You could serve over pasta, or just in a bowl with some crusty bread on the side",serve
685df8fa6c,"In a large pitcher, combine cold water, lemon juice and sugar, stir until sugar dissolves.","combine,stir"
685df8fa6c,Cover and refrigerate until chilled.,"cover,refrigerate"
685df8fa6c,"Just before serving, gradually add soda water down edge of pitcher, stir to mix.","add,stir"
685df8fa6c,Garnish.,garnish
685df8fa6c,Pour lemonade over ice cubes in glasses.,pour
685df8fa6c,Garnish each serving with lemon slices and mint sprig.,garnish
7a0cf392b2,"(NOTE: If this is too hot for you, simply use your favorite barbeque sauce. )",none
7a0cf392b2,"1) Cut sage hen breasts into 1 inch pieces, put in Ziploc bag and add 1/2 cup Soy Vay Veri Veri Teriyaki marinade.","cut,put,add"
7a0cf392b2,Marinate for 1 hour.,marinate
7a0cf392b2,2) Cut chukar breasts into large enough pieces for skewers.,cut
7a0cf392b2,Season chukar with a very light amount of Grill Mates Peppercorn and Garlic Marinade seasoning rub.,season
7a0cf392b2,3) Soak 8 bamboo skewers in water for about 20 minutes to keep them from burning on the grill or under the broiler.,soak
7a0cf392b2,"4) Mix the barbecue sauce, lemon juice, mustard, chipotles, red pepper flakes, cayenne pepper and 1/4 teaspoon freshly ground pepper in a bowl (or if this looks to be too spicy, you can just use your favorite barbeque sauce in place of this mixture).",mix
7a0cf392b2,Set aside half of the sauce for dipping.,set aside
7a0cf392b2,5) Cut 6 slices of bacon into 1 inch pieces.,cut
7a0cf392b2,6) Skewer sage hen pieces onto two skewers adding a piece of bacon into between each piece.,"skewer,adding"
7a0cf392b2,Do the same with the chukar.,none
7a0cf392b2,Brush half of the barbeque sauce onto the skewers.,brush
7a0cf392b2,7) Heat your BBQ grill to high and be sure that its good and hot.,heat
7a0cf392b2,Place skewers on tinfoil or direct on barbeque.,place
7a0cf392b2,Cook 3-5 minutes turning the meat at the halfway point to ensure that the bacon is thoroughly cooked.,cook
7a0cf392b2,Do not overcook the tender meat.,none
7a0cf392b2,Remove from heat and serve with the chipotle barbeque sauce!,"remove,serve"
c77fcd0e32,Cut potatoes into wedges.,cut
c77fcd0e32,Melt margarine.,melt
c77fcd0e32,Stir in herbs and salt.,stir
c77fcd0e32,Add potatoes and stir to coat.,"add,stir"
c77fcd0e32,Cover and cook 8-10 min in microwave or until soft.,"cover,cook"
5a699e7f61,Plop the defrosted leftovers into a big soup pot.,plop
5a699e7f61,Make sure the meat is cut into big bite-size chunks.,cut
5a699e7f61,"Add the beef broth, evaporated milk, and drained corn.",add
5a699e7f61,Simmer on low until the house smells heavenly!,simmer
5a699e7f61,Thicken with water and corn starch if needed.,thicken
5a699e7f61,Serve it up with some bread or biscuits!,serve
545ae90662,dissolve coconut in 300ml of boiling water,dissolve
545ae90662,"chop chillies finely and add to bowl with turmeric, mustard seeds, coriander, ginger, pepper and stir in a small amount of coconut to create a paste","chop,add,stir"
545ae90662,melt ghee in a frying pan or wok with a lid over a medium high heat,melt
545ae90662,"add chopped onions and garlic to melted ghee, lower heat and stir until onion slightly brown","add,heat,stir"
545ae90662,add paste mixture and stir for a couple of minutes,"add,stir"
545ae90662,add the chicken and stir into the mixture for 1 minute before adding stock,"add,stir"
545ae90662,"bring to boil and then lower heat to low, cover abd simmer for 1.5hrs.","boil,heat,cover,simmer"
545ae90662,stir occasionally to stop chicken sticking to base of pan,stir
545ae90662,"lift lid and add remaining coconut, lemon juice and salt.",add
545ae90662,Bring to boil then reduce heat again for 20mins or until the sauce has reduced slightly,"boil,heat"
545ae90662,serve with pillau rice and garnish with a sprig of freshh coriander,"serve,garnish"
0503beb01b,Preheat oven to 350 degrees F.,preheat
0503beb01b,"In a medium mixing bowl combine the flour, baking powder, baking soda, sea salt and 1/2 cup of the chopped walnuts.",combine
0503beb01b,In a separate smaller bowl mash the overripe bananas.,mash
0503beb01b,"Add the maple syrup, oil, almond milk and vanilla extract.",add
0503beb01b,Whisk until combined and add the banana mixture into the flour mixture.,"whisk,add"
0503beb01b,Do not over mix or the loaf will not rise properly.,mix
0503beb01b,"Pour batter into a lightly greased or non-stick 9 x 5 loaf pan, sprinkle with remaining 1/4 cup of walnuts and bake 45-50 minutes, until golden brown and a toothpick inserted comes out clean.","pour,sprinkle,bake"
732316c5e7,Dry-roast the peanuts in a frying pan or oven.,Dry-roast
732316c5e7,"The oil from the nuts will emerge when heated, making them easier to process!",none
732316c5e7,"Put them in the food processor, and mix at high speed.","put,mix"
732316c5e7,After 1 minute.,none
732316c5e7,After 2 minutes.,none
732316c5e7,After 3 minutes.,none
732316c5e7,After 4 minutes.,none
732316c5e7,"After mixing for 4 minutes, add the sugar bit by bit.","mixing,add"
732316c5e7,Mix for 30 seconds.,mix
732316c5e7,It's done when the sugar is mixed in.,none
732316c5e7,Put it in a clean jar and store it in the fridge.,"put,store"
732316c5e7,"Made with the amounts listed, it filled one jar perfectly!",none
732316c5e7,!,none
732316c5e7,It contains no added oil so it's a little on the firm side.,none
732316c5e7,"Please understand that depending on the peanuts you are using, it might not have a paste-like consistency.",none
862b4e87ca,"In a large bowl, whisk the all-purpose flour and the rice flour with the egg, seltzer, toasted sesame oil and 3/4 teaspoon of salt.",whisk
862b4e87ca,"Add the kimchi, shrimp, squid and scallions to the batter.",add
862b4e87ca,"In 2 medium nonstick skillets, heat 1/4 inch of vegetable oil.",heat
862b4e87ca,Spoon 2 mounds of the batter into each skillet and gently spread them into 4- to 5-inch rounds,"spoon,spread"
862b4e87ca,be sure to evenly distribute the seafood in the pancakes.,distribute
862b4e87ca,"Cook over moderately high heat until the pancakes are golden and crisp on the bottom, 4 to 5 minutes.",cook
862b4e87ca,"Carefully flip and cook over moderate heat until the pancakes are golden and crisp and the batter is cooked through, about 3 minutes longer.","flip,cook,moderate heat"
862b4e87ca,"Using a slotted spatula, transfer the pancakes to a paper towel-lined plate to drain.","transfer,drain"
862b4e87ca,"In a small bowl, combine the soy sauce and rice vinegar.",combine
862b4e87ca,Cut the seafood pancakes into wedges and serve them with the dipping sauce.,"cut,serve"
6f6ca10232,Preheat oven to 350 degrees F (175 degrees C).,preheat
6f6ca10232,"Mix together vegetable oil (yes, 1 1/2 cups of vegetable oil), sugar and eggs.",mix
6f6ca10232,"Mix in the flour, baking soda, baking powder, buttermilk, salt and vanilla.",mix
6f6ca10232,"Pour teaspoon-sized amounts of batter onto cookie sheets, leaving plenty of room in between.",pour
6f6ca10232,These cookies will puff up and get large.,none
6f6ca10232,Bake for 8 to 10 minutes.,bake
77af177d07,preheat oven to 350*,preheat
77af177d07,"butter sides and bottom of 8x8""or 9x9"" square pan.",butter
77af177d07,Butter one side of each slice of bread.,butter
77af177d07,"Put first layer with butter side down in pan, fitting to cover bottom!",put
77af177d07,!,none
77af177d07,"Sprinkle with half of the cinnamon, nutmeg and sugar.",Sprinkle
77af177d07,Add next layer of bread with butter side UP this time.Sprinkle with remainder of spices and sugar.,"add,sprinkle"
77af177d07,"Beat eggs well, add a tiny pinch of salt and milk and be sure to blend well.Pour gently over bread in pan and let soak in before putting in oven.","beat,add,blend,pour,putting"
77af177d07,Bake at 350* for about an hour till golden and slightly crusty on top.,bake
