ids,instructions,Verbs
7e91b8c67f,Now sprinkle the chocolate cake crumbs over top and stir again.,"sprinkle,stir"
7e91b8c67f,Now pour it out onto a cookie sheet and separate it as best you can.,"pour,seperate"
7e91b8c67f,Let it dry out.,dry out
7e91b8c67f,Serve with a smile!,none
865a18ff12,Blend onion and garlic in a food processor until finely chopped.,blend
865a18ff12,Add artichoke hearts,add
865a18ff12,process until chopped.,process
865a18ff12,"Add spinach, Parmesan cheese, and vegetable soup mix",add
865a18ff12,process until well incorporated.,process
865a18ff12,Transfer mixture to a nonmetallic bowl.,transfer
865a18ff12,"Blend cream cheese, mayonnaise, and sour cream in the food processor until smooth",blend
865a18ff12,stir into artichoke mixture.,stir
0f3d885d46,Preheat oven to 180 degrees C,preheat
0f3d885d46,In double boiler melt chocolate and butter constantly stirring.,"melt,constantly stirring"
0f3d885d46,"When melt, put aside","melt,put aside"
0f3d885d46,"Meanwhile, beat the eggs creamy.",beat
0f3d885d46,"then stir in chocolate mix (not hotter than 50 degrees C), slowly fold in flour","stir,fold"
0f3d885d46,"Place mixture in cupcake liners, bake for 12 minutes","place,bake"
6da62d5284,Preheat your oven to 425 F with the rack in the center position.,preheat
6da62d5284,Grease an 8 x 8 baking dish and set aside.,"grease,set aside"
6da62d5284,"In a large bowl mix together the flour, cornmeal, sugar, baking powder and salt.",mix
6da62d5284,Set aside.,set aside
6da62d5284,"In a separate bowl mix together the beaten egg, milk and melted butter.",mix
6da62d5284,Mix the wet ingredients into the dry ingredients.,mix
6da62d5284,"Pour into your prepared baking pan and if you want to make plain cornbread, stick it in the oven and bake according to the below instructions and youre done.","pour,bake"
6da62d5284,"If you want to make the jalapeno and cheddar version, continue on.",none
6da62d5284,Drizzle the honey evenly over the top of the cornbread batter in the pan then sprinkle the minced jalapeno over that.,"drizzle,sprinkle"
6da62d5284,Lastly top with the cheddar cheese evenly sprinkled all over the top.,"top,evenly sprinkled"
6da62d5284,Bake in the preheated oven for 20-25 minutes until the top is golden and the cheese is browned slightly.,bake
6da62d5284,Move to a wire rack to cool completely.,move
6da62d5284,"Once cooled, slice into squares and serve!",slice
6ca6eedfc5,Place eggs in a saucepan and cover with water.,"place,cover"
6ca6eedfc5,"Bring to a boil, remove from heat, and let eggs stand in hot water for 15 minutes.","boil,remove"
6ca6eedfc5,"Remove eggs from hot water, cool under cold running water, and peel.","remove,cool,peel"
6ca6eedfc5,"Mix salmon, mayonnaise, mustard, relish, raisins, red onion, celery seed, salt, and pepper together in a bowl.",mix
6ca6eedfc5,"Chop eggs, add to salmon mixture, and mix.","chop,add,mix"
6ca6eedfc5,"Refrigerate salmon salad until chilled completely, at least 30 minutes.",refrigerate
39df2cf10b,"In a large saucepan saute the smoked sausage, onions and garlic in olive oil until lightly browned.",saute
39df2cf10b,"Add the beans, corn, tomatoes, chicken broth, water, chili powder, oregano, cumin and salt and pepper to taste.",add
39df2cf10b,Combine thoroughly and simmer together for 30 to 45 minutes.,"combine,simmer"
39df2cf10b,Serve with corn chips and a little sour cream on the side.,none
846c64346f,Place beans in a large bowl and cover with water by at least 3 inches.,"place,cover"
846c64346f,Soak overnight.,soak
846c64346f,Drain.,drain
846c64346f,"In a large heavy saucepan, combine beans and bay leaves.",combine
846c64346f,Add enough water to cover by 3 inches.,add
846c64346f,Bring to a boil and continue boiling gently for about 45 minutes or until beans are tender.,"boil,boiling gently"
846c64346f,Drain beans reserving 4 cups of the cooking liquid.,drain
846c64346f,Preheat oven to 350^F.,preheat
846c64346f,"In a large oven proof pot with a lid, combine the onion, salt pork, ketchup, brown sugar, molasses, dry mustard and pepper.",combine
846c64346f,Stir in the beans and 3 cups of the cooking liquid.,stir
846c64346f,Cover the pot tightly with foil and then the lid.,cover
846c64346f,"Bake until the beans are very tender and the liquid has been absorbed, about 2+1/2 hours.",bake
846c64346f,Add more liquid as necessary.,add
846c64346f,Season with salt and pepper.,season
fef04e055a,Preheat your oven to 300 F.,preheat
fef04e055a,"Wash, core and peel your apples.","wash,core,peel"
fef04e055a,Cut each apple in half.,"cut,put"
fef04e055a,Peeling the apple is optional.,peeling
fef04e055a,I really dont mind the skin left on but its up to your preference.,none
fef04e055a,Use two biscuits to cover and wrap each half of the apple completely.,"cover,wrap"
fef04e055a,Press the ends of the biscuits in the middle together tightly.,press
fef04e055a,"Otherwise, they may separate in the oven a bit.",none
fef04e055a,Place the biscuit wrapped apples in an oven safe pan sprayed with cooking spray and poke a few holes in the tops with a fork.,"place,poke"
fef04e055a,Bake for about 50 minutes or until the apples are soft and cooked.,bake
fef04e055a,While they are cooking make the sauce.,make
fef04e055a,"Combine cranberry sauce, water, cornstarch and sugar in a saucepan.",combine
fef04e055a,Cook over a heat low and stir until you break down the cranberry sauce.,"cook,heat low,stir,break down"
fef04e055a,Stir in butter and cinnamon.,stir
fef04e055a,"Increase heat just a bit, bring sauce to a boil then remove from heat.","increase heat,boil,remove"
fef04e055a,Poke apples with a fork to test them and make sure they are soft.,"poke,make"
fef04e055a,"When your apples are 5 minutes away from being done, remove the dish from the oven, cover them with sauce and bake for 5 minutes.","remove,cover,bake"
fef04e055a,Serve hot and enjoy.,none
b5018d9b96,For the roasted tomatoes: Preheat your oven to 325 degrees F.,preheat
b5018d9b96,Cut your tomatoes into slices.,cut
b5018d9b96,"Lay them out flat, then drizzle on your olive oil.","flat,drizzle"
b5018d9b96,"Sprinkle on your garlic powder, dried basil, dried oregano, black pepper, and salt.",sprinkle
b5018d9b96,"Place the tomato slices flat on a sheet of foil, and then in they go for 20 minutes.",place
b5018d9b96,"For the coffee steaks: While tomatoes are roasting, combine chili powder, coffee, brown sugar, basil, and salt and pepper in a plate.",combine
b5018d9b96,Dredge each piece of steak in the rub until covered.,dredge
b5018d9b96,Melt butter on medium heat and cook steak to your liking.,"melt,cook"
b5018d9b96,"This steak was thin, so I did 3-5 minutes on each side.",none
b5018d9b96,Transfer to serving plate and cover with roasted tomatoes.,"transfer,cover"
b5018d9b96,Garnish with a green and serve with a side of steak sauce if you wish.,garnish
5493ee1898,Break the almond paste into small pieces over a medium bowl.,break
5493ee1898,"Add 1 cup of the confectioners' sugar, and work it in with your hands until incorporated.","add,work it"
5493ee1898,It will be crumbly.,none
5493ee1898,"Add another 3/4 cup of sugar, and work it in really well.","add,work it"
5493ee1898,"Pour in the corn syrup, and work it in until evenly blended.","pour,work it"
5493ee1898,"Spread remaining sugar out on a clean work surface, and knead the dough until smooth and uniform, 3 to 5 minutes.","spread,knead"
5493ee1898,"If the dough seems too sticky, knead in more sugar.",knead
5493ee1898,"Wrap the dough in plastic wrap, and refrigerate for about an hour.","wrap,refrigerate"
5493ee1898,It should have the consistency of modeling dough.,none
5493ee1898,"Break off small pieces of marzipan to color, kneading in color thoroughly until you arrive at the desired color.","break off,kneading"
5493ee1898,Then blend the colored pieces into larger portions of dough.,blend
5493ee1898,"Dust a work surface and rolling pin with confectioners' sugar, and roll dough out to 1/4 inch thickness.","dust,roll"
5493ee1898,Cut into desired shapes using small cookie cutters to make candies.,cut
38abaf2d11,"In a food processor, combine the salmon, scallion, garlic, lemon, egg, and 2 tablespoons of the breadcrumbs with a sprinkle of salt.","combine,sprinkle"
38abaf2d11,"Pulse to combine everything, then add more panko as needed to form a thick paste, almost like ground chicken.",add
38abaf2d11,"Gently form the salmon mixture into three even-sized patties, then place on a plate and into the refrigerator for 10 minutes.","gently,place"
38abaf2d11,"While the burgers chill, toast the buns cut side down in a large dry skillet over medium heat.","toast,cut"
38abaf2d11,When toasted to your liking remove them from the skillet and set aside.,"remove,set aside"
38abaf2d11,"Keeping the pan on medium heat, add enough olive oil to coat the bottom of the skillet and let it warm to nearly smoking.","add,coat,warm"
38abaf2d11,"While the oil warms, combine the mayo and Sriracha in a small bowl and taste",combine
38abaf2d11,add more hot sauce if youd like.,add
38abaf2d11,Set aside.,set aside
38abaf2d11,"When the burgers are chilled, remove them from the refrigerator and put them into the skillet.","remove,put"
38abaf2d11,"Cook them in the hot oil (increase the heat if the burgers dont immediately sizzle) for 3-5 minutes on each side, turning only once, and not moving the patties once flipped to create a brown exterior crust.","cook,increase heat"
38abaf2d11,Serve the burgers on the buns with butter lettuce topped with the the Sriracha mayo.,serve
38abaf2d11,Enjoy!,none
d26d1d230d,For the tofu marinade: Cut the white part of the lemon grass stalks into small pieces and place into a food processor (or blender) and pulse.,"cut,place,pulse"
d26d1d230d,"Add salt, sugar, shallot, garlic and Chinese Five Star spice (available in larger grocery stores or Asian specialty stores) and continue to pulse into a thick paste-like consistency.","add,pulse"
d26d1d230d,Place paste into a large bowl and add oil.,"place,add"
d26d1d230d,Stir until fully combined.,stir
d26d1d230d,Cut tofu into long strips.,cut
d26d1d230d,Rub marinade paste on all sides of the tofu and let it sit in the bowl for 30 minutes.,"rub,sit"
d26d1d230d,"For the salad: While tofu is marinating, cook vermicelli noodles according to package directions.",cook
d26d1d230d,Rinse and drain when fully cooked.,"rinse,drain"
d26d1d230d,Cut cucumber in half lengthwise and then slice into bite size pieces (forming half moons).,"cut,slice"
d26d1d230d,Set all of the salad veggies aside.,set aside
d26d1d230d,For the grilled tofu: Heat a grill pan or grill to medium.,"heat,grill"
d26d1d230d,Cook marinated tofu until grill marks are visible and tofu is cooked through (approximately 4-5 minutes each side) .,cook
d26d1d230d,Let cool and slice into bite size pieces.,"cool,slice"
d26d1d230d,"For the dressing: While the tofu is cooking, combine all of the dressing ingredients in a small bowl and stir until sugar is completely dissolved.","combine,stir"
d26d1d230d,Set aside.,set aside
d26d1d230d,"Add noodles, veggies (carrots, bell peppers, cucumber, bean sprouts), herbs (cilantro, basil, mint) and tofu into a salad bowl.",add
d26d1d230d,Top with peanuts if desired.,top
d26d1d230d,Spoon dressing over salad.,spoon
d26d1d230d,For a little extra heat..add a dash or two of Sriracha sauce (Thai chili sauceavailable in most grocery stores).,add
a746a48bba,"Make simple syrup: In a saucepan over low heat, warm sugar in 1 cup water until dissolved.","mke,low heat,warm"
a746a48bba,Cool to room temperature before using.,cool
a746a48bba,(There will be extra syrup,none
a746a48bba,refrigerate if not using immediately.),refrigerate
a746a48bba,"In a mixing glass, muddle grapes.",muddle
a746a48bba,"Add lemon juice, 1/2 ounce simple syrup and pisco, then shake with ice in a cocktail shaker.","add,shake"
a746a48bba,Strain into chilled flute.,strain
a746a48bba,Top with Champagne.,top
42e790da4b,"Peel paper liners from cupcakes, if necessary.",peel
42e790da4b,Cut rounded tops off cupcakes with serrated knife,cut
42e790da4b,set bottoms aside for later use.,set aside
42e790da4b,Use 1-inch cookie cutter to cut heart shape from each cupcake top,cut
42e790da4b,set cutouts aside.,set aside
42e790da4b,Spread 1 Tbsp.,spread
42e790da4b,COOL WHIP onto bottom of each cupcake,"cool,whip"
42e790da4b,cover with top of cupcake.,cover
42e790da4b,Spoon remaining COOL WHIP into heart-shaped holes.,spoon
42e790da4b,Decorate with heart cutouts and candies.,decorate
98fc349d05,"Fry bacon until it starts to brown, cut into bite size pieces and put into crock pot.","fry,cut,put"
98fc349d05,Brown the ground turkey with onions.,brown
98fc349d05,"Combine ground turkey, kidney and pinto beans, canned tomatoes, tomato paste, chili powder, cumin, and chicken broth and add to crock pot.","combine,add"
98fc349d05,"Use food processor or mini-prep to puree garlic, tomato, and jalapeno peppers and add to crock pot.","puree,add"
98fc349d05,Mix all ingredients in crock pot and let it cook for 6-8 hours on low.,"mix,cook"
eeb7892e81,"Place the dates in a small bowl with the lemon juice and add enough boiling water to cover, set for aside for 10 mins.","place,add,set aside"
eeb7892e81,Preheat oven to 160c.,preheat
eeb7892e81,"Mix the butter, peanut butter, sugar and sweetener together.",mix
eeb7892e81,Add the egg and vanilla.,add
eeb7892e81,Drain the dates and add to the peanut butter mixture.,"drain,add"
eeb7892e81,Blend in the remaining ingredients.,blend
eeb7892e81,"Roll into large balls, using a wet fork, press down onto a greased baking sheet.","roll,press down"
eeb7892e81,Bake for 20 minutes.,bake
3fa9eedcdc,Heat oil over medium-high in a heavy pot.,heat
3fa9eedcdc,"Add onions, garlic, and jalapeno until soft, approximately 4 minutes.",add
3fa9eedcdc,"Toss in chili powder and cumin, and cook for another minute.","toss,cook"
3fa9eedcdc,"Stir in the tomatillo salsa, beer and stock.",stri
3fa9eedcdc,Bring to a boil(bubbling) then add the chicken or turkey.,"boil,add"
3fa9eedcdc,Simmer for 10-15 minutes.,simmer
3fa9eedcdc,"While that cooks, grind up 2 handfuls of the chips and the cilantro leaves in your food processor, or chop leaves and crush chips with flat of knife if not available.","grind up,chop,crush"
3fa9eedcdc,"Stir into the chili and continue to cook until it thickens, about 8-10 minutes.","stir,cook"
3fa9eedcdc,"Remove from heat, add lime juice and spoon into bowls, serve with a side of chips or fresh tortillas.","remove,add,spoon,serve"
3fa9eedcdc,"Garnish with sour cream and shredded cheese, if desired.",garnish
3fa9eedcdc,Enjoy!,none
3fa9eedcdc,).,none
11931dc67b,"In a bowl, mix the shrimp, chives, mayonnaise, Worcestershire sauce, and chili sauce.",mix
11931dc67b,Season with salt.,season
11931dc67b,"Mound the shrimp mixture into avocado halves, and sprinkle with lemon juice.","mound,sprinkle"
11931dc67b,Place avocado halves on Bibb lettuce leaves that have been dusted with paprika.,place
11931dc67b,Garnish with strips of pimento to serve.,garnish
e8ce0da4a0,Mash up the bananas,mash up
e8ce0da4a0,Put the flour in a bowl,put
e8ce0da4a0,I decided to try stevia instead of sugar.,none
e8ce0da4a0,Olive oil (or any other good oil),none
e8ce0da4a0,One can of beer,none
e8ce0da4a0,Stir up everything but the milk,stir up
e8ce0da4a0,Add the milk,add
e8ce0da4a0,Served with ice and homemade jam.,none
4d336db376,Add all the herbs and spices to a jar and shake well.,"add,shake well"
4d336db376,"Combine the seasoning with 1 cup flour, and shake again until thoroughly mixed","combine,shake"
4d336db376,"In a saucepan, bring the milk to a gentle simmer, and add the rosemary if using.","gentle simmer,add"
4d336db376,.,none
4d336db376,"Poach the chicken in the milk for 20 to 25 minutes with the pan covered, turning halfway through",poach
4d336db376,Remove chicken from the pan and drain on kitchen paper.,"remove,drain"
4d336db376,Allow to rest and cool for 10-15 minutes,"rest,cool"
4d336db376,Heat the oil to 180 C (355 F),heat
4d336db376,"Dip chicken into the beaten egg, then in to the breading mix.",dip
4d336db376,Repeat,repeat
4d336db376,Fry the chicken for 5-7 minutes until the breading is crispy and golden brown.,fry
4d336db376,Remove the chicken from the pan and drain excess oil on kitchen paper.,"remove,drain"
4d336db376,Pierce the chicken with a skewer or a fork.,pierce
4d336db376,"If the juices run clear, the chicken is cooked.",none
4d336db376,"If the juices run pink, put back in the fryer for another 2-3 minutes then test again",put
4d336db376,"Serve with beans, fries, and/or coleslaw",serve
a05971e930,Cook green beans according to package directions.,cook
a05971e930,"Combine green beans, with remaining ingredients.",combine
a05971e930,Mix well.,mix well
a05971e930,Serve hot with salt and pepper to taste.,serve
68c33f9f28,"In a large saucepan stir together the cocoa powder, sugar substitute or sugar, crushed candies, and 3/4 cup of the milk.",stir
68c33f9f28,Cook and stir over medium heat until mixture just comes to boiling.,"cook,stir"
68c33f9f28,Stir in the remaining milk,stir
68c33f9f28,heat through.,heat
68c33f9f28,Do not boil.,
68c33f9f28,Remove from heat.,remove
68c33f9f28,"If desired, beat with a rotary beater until frothy.",beat
68c33f9f28,"Mocha Cooler: Prepare as above, except omit the peppermint candies",
68c33f9f28,increase the heat stable sugar substitute to equal 1/3 cup sugar or increase the sugar to 1/3 cup.,increase heat
68c33f9f28,Add 2-3 teaspoons instant coffee crystals with the 3/4 cup milk.,add
68c33f9f28,Cook and stir over medium heat until mixture just comes to boiling.,"cook,stir"
68c33f9f28,Remove from heat,remove
68c33f9f28,stir in the remaining milk.,stir
68c33f9f28,Serve immediately over ice.,serve
68c33f9f28,"(Or, cover and chill.","cover,chill"
68c33f9f28,Stir before serving over ice).,stir
92b3d3dc68,Preheat oven to 375F,preheat
92b3d3dc68,butter and flour two 9x5-inch loaf pans.,none
92b3d3dc68,"In a large bowl, whisk together oil, honey (if you measure out the oil first, and then put honey in the oiled measuring cup, the honey will come out easier) eggs and sweet potato puree until creamy.",whisk
92b3d3dc68,"In a small bowl, combine both flours, sugar, baking soda, salt and spices.",combine
92b3d3dc68,"In a measuring cup, combine buttermilk, balsamic vinegar and vanilla extract.",combine
92b3d3dc68,"Fold dry ingredients into sweet potato mixture, alternating with buttermilk",fold
92b3d3dc68,mix until just combined,mix
92b3d3dc68," if using pecans and/or raisins, toss them with 1 tblsp flour and fold them into the batter quickly","toss,fold"
92b3d3dc68," scrape batter into prepared loaf pans and bake for about 60 minutes, or until breads test done when toothpick is inserted into centre and comes out clean","scrape,bake"
92b3d3dc68," if bread appears to be browning too quickly, tent loosely with some foil and continue baking (I did this about 1/2 an hour into baking).","tent loosely,baking"
92b3d3dc68,Cool in pan for 10 minutes before removing.,cool
92b3d3dc68,"Note: Like most quick breads (and cakes), this slices up best a day after baking- I couldn't wait!",none
b7aa5986d1,Cook rotini pasta according to directions on package.,"cook,stir"
b7aa5986d1,Add remaining ingredients and mix thoroughly.,"add,mix thoroughly"
c95d54d023,"blend sugar, molasses, butter, apple sauce until creamy.",blend
c95d54d023,add banana and egg.,add
c95d54d023,blend until creamy.,blend
c95d54d023,"in separate bowl wisk together flour, oats, flaxseed and baking powder.",wisk
c95d54d023,add flour mixture to banana mixture mix just until blended.,"add,mix"
c95d54d023,blend in vanilla.,blend
c95d54d023,bake in bread pan at 350 degrees for 45 minutes or until toothpick comes out clean.,bake
6bcc60c9c9,Core and cut apples into wedges.,"core,cut,wedges"
6bcc60c9c9,Place in medium saucepan with lemon juice and 1/2 cup (125 mL) water.,place
6bcc60c9c9,Cover and gently simmer to soften (23 minutes).,"cover,gently simmer"
6bcc60c9c9,Drain.,drain
6bcc60c9c9,Toss with maple syrup and cinnamon.,toss
6bcc60c9c9,Set aside.,set aside
6bcc60c9c9,"Whisk eggs, Almond Fresh, sugar, salt and spices in a bowl.",whisk
6bcc60c9c9,"Soak each slice of bread, turning to soak both sides.",soak
6bcc60c9c9,Melt butter in nonstick fry pan.,melt
6bcc60c9c9,"When bubbling, add soaked bread in batches.","bubbling,add"
6bcc60c9c9,Turn part way through until golden brown on both sides.,golden brown
6bcc60c9c9,Keep warm.,warm
6bcc60c9c9,"Divide among 4 plates, drizzle with applesyrup mixture, sprinkle with icing sugar and serve.","divide,drizzle,sprinkle"
7d7b1b4403,"Place apples in a large pot with enough water to cover, and bring to a boil.","place,water,boil"
7d7b1b4403,"Reduce heat to low, and simmer 15 minutes, or until soft.","reduce heat,simmer,soft"
7d7b1b4403,"Drain, and cool.","drain,cool"
7d7b1b4403,"Place in a large bowl, and toss with 2 tablespoons sugar to evenly coat.","place,toss"
7d7b1b4403,"In a large bowl, whip together the 1/2 cup butter and 2 tablespoons sugar until fluffy.",whip
7d7b1b4403,Mix in the egg.,mix
7d7b1b4403,"In a separate bowl, mix 2 cups flour, baking powder, and custard powder.",mix
7d7b1b4403,Mix dry ingredients into the bowl with butter and sugar.,mix
7d7b1b4403,Press crust into the bottom and up the sides of a 9 inch springform pan.,press
7d7b1b4403,Preheat oven to 400 degrees F (200 degrees C).,preheat
7d7b1b4403,Drain apples and place into the crust.,"drain,place"
7d7b1b4403,"Cut together 3/4 cup sugar, 3/4 cup butter, 1 1/4 cups flour, and cinnamon.",cut
7d7b1b4403,Mix in coconut and oats.,mix
7d7b1b4403,Sprinkle over the apples.,sprinkle
7d7b1b4403,"Bake 1 hour in the preheated oven, until golden brown.","bake,preheated,golden brown"
7d7b1b4403,Remove sides from pan and allow crumble to cool before serving.,"remove,crumble,cool"
6c3cf7db1f,Decase the sausage and saute in a large pot,"decase,saute"
6c3cf7db1f,use a wooden spoon to crumble the sausage as it cooks.,crumble
6c3cf7db1f,"Once the sausage is nicely browned, stir in the onion, garlic, chili powder and cumin and continue cooking until the onion softens about 5 minutes.","browned,stir"
6c3cf7db1f,Add the beer and allow it to simmer for an additional 5 minutes scraping up any brown bits from the bottom of the pan.,"add,simmer"
6c3cf7db1f,"Stir in the tomatoes, tomato paste and allow it to simmer, uncovered for an additional 10-15 minutes on med-low, stirring occasionally.","stir,simmer,stirring occasionally"
6c3cf7db1f,Taste and adjust seasonings with salt and pepper.,adjust seasonings
6c3cf7db1f,Finally stir in the beans and the corn.,stir
6c3cf7db1f,Let this come to a simmer and its ready to serve!,simmer
6c3cf7db1f,(Can be prepared a day ahead.,none
6c3cf7db1f,).,none
c435fa197a,"In a large frying pan, cook the sausage and ground beef together with the chopped onions until no longer pink and drain all grease.","cook,drain all grease"
c435fa197a,Cook ravioli according to package directions (only for about 3 minutes or so I think) Drain and rinse in cold water.,"cook,drain,rinse,cold water"
c435fa197a,"In a 13x9 baking dish, spread a small amount of sauce (just enough to cover bottom) and layer enough ravioli to cover.",
c435fa197a,Stack the slices of pepperoni and cut them into narrow strips and spread half of it over the ravioli.,"stack,cut,narrow strips"
c435fa197a,Now spread all the meat over that and pour the remaining sauce on top of it.,"spread,pour"
c435fa197a,"Sprinkle with 1-1/2 cups mozzerella cheese, then layer the remaining ravioli and cheese and sprinkle all of the garlic powder on it.","sprinkle,layer"
c435fa197a,Spread the remaining half of pepperoni strips on top of cheese.,spread
c435fa197a,Cover with foil and bake at 375* for about 20-25 minutes.,"cover,bake"
c435fa197a,Remove foil and bake uncovered another 10 minutes or until cheese and pepperoni are golden.,"remove,bake,golden"
c435fa197a,Serve with no yeast Beer Bread (recipe# 73440).,serve
e61d107d11,1,none
e61d107d11,Preheat the oven to 350F.,preheat
e61d107d11,2,none
e61d107d11,"Using an electric mixer, beat the cream cheese until it is smooth.","beat,smooth"
e61d107d11,Beat in the mayonnaise until combined.,"beat,combined"
e61d107d11,"Add 11/2 cups of the Parmesan, the artichoke hearts, scallions, garlic, hot sauce, black pepper, and salt and mix with a spatula until combined.","add,mix,combined"
e61d107d11,3,none
e61d107d11,"Scrape the mixture into a wide, shallow gratin or baking dish thats pretty enough for serving and top with the remaining 1/4 cup Parmesan.","scrape,top"
e61d107d11,"Bake until the dip is bubbling and the top is golden, 30 to 40 minutes.","bake,bubbling,golden"
e61d107d11,"Serve hot, with crackers, tortilla chips, or crusty bread for dipping.",none
bd5b804128,"Place the ricotta in a large bowl and whip it to break up the curd, then add the egg and stir well to incorporate.","place,whip,add,stir"
bd5b804128,Add the Parmesan and salt and mix well.,add
bd5b804128,"Place the flour in a large shallow dish, then use teaspoons to make oval-shaped gnocchi of about 1/2 teaspoon dough at a time and drop them into the flour (don't let the gnocchi touch each other or they'll stick).","place,make"
bd5b804128,"Drop 6 gnocchi into the flour, then coat them lightly by rolling the plate","drop,coat"
bd5b804128,carefully dust excess flour off the gnocchi and place them on a parchment-lined cookie sheet and repeat process until all the gnocchi are made.,"dust,place,repeat process"
bd5b804128,"Place gnocchi in the refrigerator for about 2 hours or until they're firm - you can refrigerate them overnight, but they're better eaten the same day as they're prepared.","place,refrigerate"
