ids,instructions,Verbs
4afaeb9182,Increase heat to high.,increase heat
4afaeb9182,Add carrots and brussels sprouts or corn,add
4afaeb9182,stir-fry 1 minute.,stir-fry
4afaeb9182,"Add garlic, then crumble in rice",add
4afaeb9182,stir-fry until rice begins to crackle and brown.,stir-fry
4afaeb9182,Add sugar and beaten egg.,add
4afaeb9182,Remove from heat and stir until egg is cooked through.,"remove,stir"
4afaeb9182,Stir in lemon juice and salt and pepper to taste.,stir
4afaeb9182,Spoon rice onto 4 plates and garnish each with torn prosciutto.,"spoon,garnish"
2f5a0e969a,Make 3 times the amount of buttercream.,make
2f5a0e969a,Increase the amount according to the amount of decorations.,increase
2f5a0e969a,Slice the sponge in half to make 2 layers.,slice
2f5a0e969a,Spread apricot jam on the bottom half and cover completely with sliced strawberries.,"spread,cover"
2f5a0e969a,Spread buttercream on the top spongecake layer.,spread
2f5a0e969a,"Put the top layer on the bottom, buttercream side down.",put
2f5a0e969a,Spread buttercream all over the cake and squeeze buttercream around the edges.,"spread,squeeze"
2f5a0e969a,Decorate with silver dragees.,decorate
2f5a0e969a,"Add strawberries and holly for decoration, and it's done.",add
2f5a0e969a,Remove the holly and it becomes a birthday cake.,remove
e06187d495,"Sear the tuna filet in a frying pan, 1 minute on the first side, 30 seconds on the other over medium heat.",sear
e06187d495,"Slice the tuna into 7 mm, then top the slices on a bed of lettuce.",slice
e06187d495,Put the butter and garlic in the pan that you cooked the tuna and saute until fragrant.,"put,saute"
e06187d495,"Finally, drizzle in the soy sauce.",drizzle
e06187d495,"Lightly simmer, then pour all over the tuna to finish!","lightly simmer,pour"
e06187d495,!,none
e06187d495,Garnish with sprouts and cherry tomatoes (optional).,garnish
c9820ee5b1,Flatten bread with a rolling pin.,flatten
c9820ee5b1,"Mix cream cheese, egg yolk, and powdered sugar.",mix
c9820ee5b1,Combine sugar and cinnamon,combine
c9820ee5b1,set aside.,set aside
c9820ee5b1,Spread 1 T cheese mixture on each slice bread.,spread
c9820ee5b1,Roll up.,roll up
c9820ee5b1,"Dip in melted butter, then in cinnamon sugar.",dip
c9820ee5b1,Place on ungreased baking sheet.,place
c9820ee5b1,"Bake at 350F for 20 minutes, or until golden.",bake
30ae8a9384,Preheat oven to 450 degrees.,preheat
30ae8a9384,"In 12-inch skillet, heat oil on medium until hot.",heat
30ae8a9384,"Add peppers and onion, and cook 10 minutes or until tender, stirring often.","add,cook,stirring often"
30ae8a9384,"Add mushrooms, wine, and thyme",add
30ae8a9384," cook on medium-high 3 minutes, stirring frequently.","cook,stirring frequently"
30ae8a9384,"Meanwhile, spray 13"" by 9"" glass or ceramic baking dish with nonstick cooking spray.",spray
30ae8a9384,"Arrange fillets in baking dish, folding under narrow ends.","arrange,folding"
30ae8a9384,"Sprinkle with lemon juice, 1/4 teaspoon salt, and 1/4 teaspoon freshly ground black pepper.",sprinkle
30ae8a9384,Spoon hot vegetable mixture from skillet on top of fish in baking dish.,spoon
30ae8a9384,Bake fish 15 to 18 minutes or until opaque throughout.,bake
30ae8a9384,Garnish with thyme leaves if you like.,garnish
8ca19614e4,Make the cupcakes Preheat the oven to 350 and line a 12-cup muffin pan with paper liners.,"make,preheat"
8ca19614e4,"In a bowl, whisk the flour, baking powder, baking soda and salt.",wishk
8ca19614e4,"In a large bowl, whisk the cocoa powder and chocolate chips with the boiling water until smooth.",whisk
8ca19614e4,"Add the sugar, sour cream, canola oil, eggs and vanilla",add
8ca19614e4,whisk until no streaks remain.,whisk
8ca19614e4,Whisk in the dry ingredients until incorporated.,whish
8ca19614e4,"Make the cupcakes Fill the prepared muffin cups with the batter and bake for about 20 minutes, until a toothpick inserted in the center of the cupcakes comes out clean.","make,fill,bake"
8ca19614e4,Transfer the cupcakes to a rack and let cool completely.,"transfer,let cool"
8ca19614e4,"Meanwhile, make the frosting In a heatproof bowl set over a saucepan of simmering water (the bottom of the bowl shouldn't touch the water), whisk the egg whites with the sugar and cream of tartar until the sugar has dissolved, about 3 minutes.","make,simmering,whisk"
8ca19614e4,Remove from the heat.,remove
8ca19614e4,"Using a handheld electric mixer, beat the whites at high speed until stiff peaks form, about 6 minutes.",beat
8ca19614e4,Beat in the vanilla.,beat
8ca19614e4,"Meanwhile, make the frosting Transfer the meringue frosting to a piping bag fitted with a large round pastry tip and frost the cupcakes.","make,transfer,frost"
35f283dcf9,Add all the vegetable ingredients together in a large bowl.,add
35f283dcf9,Sprinkle the salt and black pepper atop.,sprinkle
35f283dcf9,Add the red wine vinegar and olive oil.,add
35f283dcf9,Mix about so that all the liquids on the bottom get to the top.,mix
35f283dcf9,Chill in fridge for 15 to 30 minutes.,chill
6e5cd9be37,Pulse mushrooms in food processor until finely chopped.,pulse
6e5cd9be37,Transfer to bowl.,transfer
6e5cd9be37,Plus shallots in food processor until finely chopped.,put
6e5cd9be37,Add to bowl with the mushrooms.,add
6e5cd9be37,Melt butter in skillet and cook mushroom mixture about 10 minutes -- until mushrooms have released their liquid and most has evaporated and the shallots are starting to brown.,"melt,cook"
6e5cd9be37,Season with salt and pepper.,season
6e5cd9be37,Preheat oven to 350 degrees.,preheat
6e5cd9be37,"Grease 9"" deep-dish pie pan or gratin dish.",grease
6e5cd9be37,"Bring milk, flour, and garlic to a simmer in saucepan over medium heat, whisking constantly.","bring to simmer,whisking constantly"
6e5cd9be37,Whisk in 1/2 c cheese and nutmeg.,whisk
6e5cd9be37,Season with salt and pepper.,season
6e5cd9be37,Spread 1/3 of squash slices on bottom of pan.,spread
6e5cd9be37,Top with 1/3 cheese mixture and 1/2 of mushroom mixture.,top
6e5cd9be37,"Repeat layers, ending with cheese sauce.",repeat
6e5cd9be37,Sprinkle with remaining cheese.,sprinkle
6e5cd9be37,Bake 45 minutes or until squash is tender and top is browned.,bake
6e5cd9be37,Let stand 10 minutes before serving.,let stand
07e8ad04e4,Heat the oven to 200.,heat
07e8ad04e4,Put 1/3 cup of the oil in a large skillet over medium heat.,put
07e8ad04e4,"When its hot, add the leeks and shallots and cook, stirring occasionally, until softened, about 10 minutes.","add,cook,stirring occasionally"
07e8ad04e4,"Add the cumin, coriander, cardamom and cinnamon and continue to cook for 5 minutes.","add,continue to cook"
07e8ad04e4,"Transfer the onion mixture to a large bowl and add the chili, parsley, cilantro, manouri and salt.",transfer
07e8ad04e4,"Allow to cool, then stir gently.","allow to cool,stir gently"
07e8ad04e4,"Beat the egg white until soft peaks form, and fold it into the onions.","beat,fold"
07e8ad04e4,"In a separate bowl, stir together the flour, baking powder, whole egg, milk and butter to form a smooth batter.",stir
07e8ad04e4,Gently fold it into the onion mixture.,gently fold
07e8ad04e4,Put 2 tablespoons of the remaining oil in a large skillet over medium heat.,put
07e8ad04e4,"When it's hot, ladle four spoonfuls (about half of the batter) into the pan to make four large fritters.",ladle
07e8ad04e4,"Fry them until golden and crisp, 2 to 3 minutes per side.",fry
07e8ad04e4,"Drain on paper towels, then transfer to a platter in the oven to keep warm.","drain,transfer"
07e8ad04e4,"Repeat with the remaining batter, adding more of the oil as needed.","repeat,adding"
07e8ad04e4,"Serve warm or at room temperature, with lemon wedges.",serve
8264919fb1,"Rinse the quinoa in 3 changes of water in a bowl, rubbing the grains and letting them settle each time before pouring off the water (if the quinoa does not settle, drain in a large fine-mesh sieve after each rinse).","rinse,rubbing"
8264919fb1,"Cook the quinoa in a 3- to 4-quart saucepan of boiling well-salted water until tender, about 15 minutes.","cook,boiling"
8264919fb1,Drain well in a sieve.,drain well
8264919fb1,"Meanwhile, heat 2 tablespoons of the olive oil in a medium skillet over moderate heat.","heat,moderate heat"
8264919fb1,"Add the onions and cook, stirring occasionally, until golden and softened, 8 to 10 minutes.","add,cook,stirring occasionally"
8264919fb1,"Add the chorizo and cook until it starts to release its oil, about 2 minutes.","add,cook"
8264919fb1,"Stir in the mushrooms and cook, stirring occasionally, until golden, about 3 minutes.","stir,cook,stirring ocassionally"
8264919fb1,Add the drained quinoa and stir to combine.,"add,stir"
8264919fb1,Season to taste with salt and pepper.,season
8264919fb1,"Remove from the heat, and stir in the ricotta salata and chopped parsley.","remove,stir"
8264919fb1,Set aside.,set aside
8264919fb1,Cut the bell peppers in half lengthwise and discard the ribs and seeds.,"cut,discard"
8264919fb1,"Cook the peppers in a medium pot of simmering salted water until crisp-tender when pierced with a knife, about 5 minutes.","cook,simmering"
8264919fb1,Drain in a colander and let cool slightly.,"drain,let cool"
8264919fb1,Preheat the oven to 400.,preheat
8264919fb1,Lightly oil a medium baking dish.,lightly oil
8264919fb1,Fill the pepper halves with the quinoa mixture and arrange in the dish.,fill
8264919fb1,Drizzle the peppers with the remaining 1 tablespoon olive oil.,drizzle
8264919fb1,"Bake until quinoa mixture is golden-brown on top and piping hot, about 20 minutes.",bake
bc5b143802,Make salsa first.,make
bc5b143802,Combine all salsa ingredients except cilantro and refrigerate up to one day.,"combine,refrigerate"
bc5b143802,Add cilantro just before serving.,add
bc5b143802,Puree all ingredients for chicken marinade and put in plastic Ziploc bag with chicken.,"puree,put"
bc5b143802,Marinade no more than 30 minutes.,marinade
bc5b143802,Grill and serve.,"grill,serve"
a6187bedca,MAKE THE SUNDAES Melt the chocolate in a small saucepan set in a larger pan of simmering water,melt
a6187bedca,stir until smooth.,stir
a6187bedca,"Meanwhile, in a medium saucepan, combine the water with the sugar and corn syrup and bring to a boil over high heat.","combine,bring to a boil,high heat"
a6187bedca,"Whisk in the cocoa powder, reduce the heat to moderate and cook, stirring, until slightly thickened, about 3 minutes.","whisk,reduce heat,cook,stirring"
a6187bedca,Remove the pan from the heat and whisk in the melted chocolate and espresso dissolved in water.,"remove,whisk"
a6187bedca,"MAKE THE SUNDAES In a medium saucepan, combine the sugar and corn syrup and cook over moderately high heat, without stirring, until a deep-amber caramel forms, about 6 minutes.",
a6187bedca,"Using a wet pastry brush, wash down any crystals from the side of the pan.","combine,cook,moderately high heat"
a6187bedca,Remove the pan from the heat and carefully stir in the cream and butter,"remove,stir"
a6187bedca,the sauce will bubble up.,none
a6187bedca,"Cook the caramel sauce over moderate heat for 5 minutes, stirring occasionally.","cook,moderate heat,stirring occasionally"
a6187bedca,MAKE THE SUNDAES Spoon the ice cream into sundae glasses or bowls.,spoon
a6187bedca,"Top with the hot fudge and caramel sauces, sprinkle with nuts and serve.","top,sprinkle"
7c6df4f88e,"Combine sugar, corn syrup, water, butter, and salt in a saucepan.",combine
7c6df4f88e,Cook over medium-high heat to hard ball stage.,cook
7c6df4f88e,Remove from heat and add vanilla.,"remove,add"
7c6df4f88e,Pour over popcorn.,pour over
7c6df4f88e,"When cool enough to handle, form into balls with buttered hands.",form
4fbe53013a,Sprinkle about 1/4 cup of the sugar over the zest in a mid-sized bowl or mortar and squish together with a pestle or the back of a heavy spoon.,"sprinkle,squish"
4fbe53013a,Continue smooshing and adding sugar 1/4 cup at a time until the sugar and orange zest are almost paste-like.,"continue somooshing,adding"
4fbe53013a,"Transfer this mixture to a large, clean jar with a tight fitting lid.",transfer
4fbe53013a,Pour the brandy over the mixture and stir well.,"pour,stir well"
4fbe53013a,"Cap tightly and age 1-3 months, shaking weekly, in a cool, dark place.","cap,shaking"
4fbe53013a,(Basements are usually perfect for this!),none
4fbe53013a,"After at least 4 weeks (the longer you let this age, the better it will be!)",none
4fbe53013a,shake the jar well and pour the mixture through a fine mesh stainless-steel strainer into a bowl or large measuring cup with a spout.,"shake,pour"
4fbe53013a,Rinse the strainer and the jar that you used to age the liqueur.,rinse
4fbe53013a,Line the strainer with cheesecloth or a clean tea towel and pour the liqueur back into the aging jar.,"line,clean,pour"
4fbe53013a,"If using the liquid glycerine, stir it in at this point.",stir
4fbe53013a,Cap tightly again and continue aging for an additional 1-3 months.,"cap,continue aging"
57c97d055e,Place roast and onion in crock pot sprayed with Pam.,roast
57c97d055e,"Add bay leaf, soy sauce and garlic powder.",add
57c97d055e,Cover.,cover
57c97d055e,Cook on High 1 hour and then low 6 hours.,cook
57c97d055e,Slice and Serve.,"slice,serve"
d54ea09f2f,"Sift together the flour, baking powder, salt, nutmeg, and cinnamon into a bowl, set aside.","sift,set aside"
d54ea09f2f,"Stir together the rum, sweet potatoes, banana, pineapple, and butter",stir
d54ea09f2f,mix well.,mix well
d54ea09f2f,Fold the flour into the sweet potato mixture until well combined.,fold
d54ea09f2f,Heat oil in deep-fryer to 375 degrees F (190 degrees C).,heat
d54ea09f2f,"Drop tablespoon-sized pieces of batter into the hot oil, and fry until light golden brown.","drop,fry"
d54ea09f2f,"Drain on paper towels, and dust with powdered sugar.","drain,dust"
7e2b076af9,Place clams in a large pot with enough water to cover.,place
7e2b076af9,Stir in cornmeal.,stir
7e2b076af9,Let stand for about 20 minutes.,let stand
7e2b076af9,Rinse clams thoroughly before cooking.,rinse
7e2b076af9,Heat the olive oil and garlic in a large pot over medium heat.,heat
7e2b076af9,"When the garlic is fragrant, add the chourico, onion, and red pepper flakes.",add
7e2b076af9,"Cook for 2 or 3 minutes, then pour in about 3/4 of the beer.","cook,pour"
7e2b076af9,"Let simmer for a few more minutes, then add the clam juice, tomatoes, and rinsed clams.","simmer,add"
7e2b076af9,"Cover, and simmer until all clams have opened.","cover,simmer"
7e2b076af9,"Season with oregano, salt and pepper before serving.",season
7e2b076af9,Drink or discard remaining beer.,"drink,discard"
cdeaa36792,Preheat oven to gas 6 / 180C / 350F,preheat
cdeaa36792,"For the filling toss the fruit, brown sugar, cornstarch, spices, salt and sunflower spread together in a large bowl, then put into a large greased oven dish","toss,put"
cdeaa36792,"Combine the flour, sugar and butter with your fingers to make crumbs and sprinkle it thickly over the fruit","combine,sprinkle"
cdeaa36792,Bake for 45 mins until the crumble topping is golden and the fruit is soft.,bake
cdeaa36792,Serve with custard or ice cream while still warm,serve
64c80053ba,Put everything in large heavy saucepan,put
64c80053ba,Bring to a boil,bring to a boil
64c80053ba,Simmer until thick like jelly,simmer
64c80053ba,Talk would with orange zest at the end,none
64c80053ba,Then put in the refrigerator to cool down and eat :),"put,cool"
a2a9040994,Saute the ham slices in the butter for 2 minutes.,saute
a2a9040994,Place the ham on English muffins.,place
a2a9040994,Poach the eggs in simmering water in a frying pan (a splash of white vinegar will help keep them together).,poach
a2a9040994,When set remove with a slotted spoon and place on ham.,"remove,place"
a2a9040994,"Whirl eggs yolks, lemon juice and salt and pepper in blender on high for 30 seconds.",whirl
a2a9040994,Uncover and continue to blend on high while slowly adding the melted butter in a thin slow stream.,"unciver,continue to blend,slowly adding"
a2a9040994,When the sauce is thick and creamy pour over eggs and serve.,"pour,serve"
312a070c51,Cook pasta according to directions on the package.,cook
312a070c51,"When done drain it, put it back in the pot and set it aside.","drain,put back,set aside"
312a070c51,Cook the mushrooms in a saucepan over medium heat for about 2-3 minutes.,cook
312a070c51,"Add the can of condensed cream of mushroom soup to the pan, then fill the can half full with water (you can substitute milk for a creamier pasta) and pour that in as well.","add,fill,pour"
312a070c51,Cook on medium heat stirring frequently.,"cook,stirring frequently"
312a070c51,Keep at a low boil.,low boil
312a070c51,"After about 5 minutes add the chopped parsley, pinch of basil and cracked pepper and stir.","add,stir"
312a070c51,Cook for another 5-10 minutes.,cook
312a070c51,Slice avocado and tomato into small wedges.,slice
312a070c51,Pour mushroom sauce over pasta and stir.,"pour,stir"
312a070c51,Cook for about 1 minute over medium heat or until heated through.,cook
312a070c51,"Serve pasta topped with avocado and tomato wedges, Italian cheese and extra parsley for garnish.",serve
08786c6c94,Toast bread & keep warm on plates.,toast
08786c6c94,Fry duck eggs in butter & place them on toast.,"fry,toast"
08786c6c94,"Add a good knob of butter to frying pan, saute mushrooms for 30 seconds, tossing frequently.","add,saute,tossing frequently"
08786c6c94,"Scatter mushrooms around the eggs, add seasoning and serve immediately.","scatter,add,serve"
ec90eb3d44,Preheat an oven to 350 degrees F (175 degrees C).,preheat
ec90eb3d44,"Season the pork loin evenly with the onion powder, garlic powder, and black pepper",season
ec90eb3d44,place into a roasting pan.,place
ec90eb3d44,"Cook until the pork is no longer pink in the center, about 90 minutes.",cook
ec90eb3d44,An instant-read thermometer inserted into the center should read 145 degrees F (63 degrees C).,none
2236ebe9ad,Preheat the oven to 180AsC (360AsF).,preheat
2236ebe9ad,Wash the chicken under cold running water and dry with paper towel.,"wash,dry"
2236ebe9ad,"Combine the oil, sage, and rosemary in a small bowl and season with salt and pepper.","combine,season"
2236ebe9ad,Rub the the herb mixture over the chicken.,rub
2236ebe9ad,Put the sliced garlic inside the cavity.,put
2236ebe9ad,Place the chicken in a roasting pan.,place
2236ebe9ad,Place the washed potatoes in a large bowl.,place
2236ebe9ad,"Add the oil, rosemary sprigs and garlic, and toss well to coat.","add,toss"
2236ebe9ad,Season with salt and pepper.,season
2236ebe9ad,"Arrange the sliced potatoes around the chicken, in a roasting pan.",arrange
2236ebe9ad,"Cook in the oven for 50 minutes, basting occassionally with the pan juices, until both are tender and golden brown.","cook,basting"
2236ebe9ad,Slice the chicken into pieces.,slice
2236ebe9ad,Transfer to a serving platter with roasted potatoes.,transfer
2236ebe9ad,Pour the pan juices over the chicken and serve.,"pour,serve"
54623bacef,"In large bowl, beat butter, granulated sugar, brown sugar, and vanilla until light and fluffy.",beat
54623bacef,"Add eggs, one at a time, beating well.","add,beating well"
54623bacef,"Gradually add flour, salt, and baking soda, beating until well blended.","gradually add,beating"
54623bacef,Stir in chocolate chips and nuts.,stir
54623bacef,Spread in greased 14 inch round pizza pan.,spread
54623bacef,Bake at 375 degrees F (190 degrees C) for 20-25 minutes.,bake
54623bacef,Cool cookie in pan on a cooling rack.,cool
54623bacef,Decorate as desired.,decorate
9d823d055f,Pop everything into the bowl of your blender and give it a whir until well combined.,"pop,whir"
9d823d055f,Optional: top with another scoop of ice cream!,top
22a455664b,Heat oil in a large nonstick skillet over medium-high heat.,heat
22a455664b,"Add onion, and cook 4 minutes or until onion is golden, stirring frequently.","add,cook,stirring frequently"
22a455664b,"Stir in coconut milk, curry paste, and black pepper.",stir
22a455664b,Add the chicken,add
22a455664b,bring to a simmer.,bring to simmer
22a455664b,"Cook 8 minutes or until chicken is done, stirring frequently.","cook,stirring frequently"
22a455664b,"Stir in cilantro and remaining ingredients, and cook 1 minute.",stir
7d68a3b51e,Cut the meat and vegetables into 2 cm pieces.,cut
7d68a3b51e,Shred the shimeji mushrooms into small clumps.,shred
7d68a3b51e,"Wet the potatoes with water, put on a plate, cover with cling film and microwave until soft.","wet,put,cover,microwave"
7d68a3b51e,Heat oil in a pan.,heat
7d68a3b51e,Stir fry the meat and carrot over medium heat for 4 minutes.,stir fry
7d68a3b51e,Add onion and shimeji mushrooms and stir fry until the onion has become translucent.,"add,stir fry"
7d68a3b51e,Add curry powder and stir fry until fragrant.,"add,stir fry"
7d68a3b51e,Add flour and stir well to avoid lumps.,"add,stir well"
7d68a3b51e,"Add water, mix well to dissolve the flour over medium heat.","add,mix well"
7d68a3b51e,Add the soup stock and sugar.,add
7d68a3b51e,"After it starts to boil, add potato, butter, garlic and milk and stir well.","boil,add,stir"
7d68a3b51e,"When it comes to a boil, skim off any scum that surfaces.",skim off
7d68a3b51e,"Simmer until it reaches the desired thickness, stirring occasionally so that it won't burn.","simmer,stirring occasionally"
7d68a3b51e,Check the taste and add salt if needed.,"check,add"
7d68a3b51e,Sprinkle a little pepper to enhance the aroma and it's done.,sprinkle
a126aefb7c,"Begin by soaking your pea shoots in cold water, picking over any of the bad leaves, or stems.","begin,soaking,picking"
a126aefb7c,"Next, heat a wok, or a large skillet on medium to high heat.",heat
a126aefb7c,"Add the oil, toss in the garlic and ginger, and cook just until fragrant.","add,toss,cook"
a126aefb7c,Remove the greens from the water (discard the soaking water) and toss them into the wok.,"remove,toss"
a126aefb7c,"Add in the 1/4 cup of water, and give them a gentle toss.","add,gently toss"
a126aefb7c,"Continue to toss gently, watching the greens melt down into a delicious pile of goodness.","toss fently,melt"
a126aefb7c,"Now is the time to toss in the soy sauce, oyster sauce, and the sugar.",toss
a126aefb7c,"Mix well, making sure you incorporate all of the sauces.",miz well
a126aefb7c,"Plate, and serve with steamed rice.","plate,serve"
a126aefb7c,"Trust me on this one, if you are in need of great greens, this is the recipe for you.",none
a126aefb7c,"My five year old simply loved them, and that makes her dad proud!",none
a126aefb7c,"Enjoy, and happy new year.",none
e68daad9a9,Combine the ingredients in a food processor.,combine
e68daad9a9,Process until the dough mixture leaves the sides of the bowl.,process
e68daad9a9,Remove to a mixing bowl and knead by hand for a few minutes until smooth.,"remove,knead"
e68daad9a9,"(If the dough is too dry, add a few drops of water.)",none
e68daad9a9,Divide into 4 equal parts and shape them into discs.,"divide,shape"
e68daad9a9,Wrap in plastic wrap and let rest for 1 hour.,"wrap,let rest"
e68daad9a9,"Put the cheeses, salt, and pepper in a blender and pulse.","put,pulse"
e68daad9a9,Add the egg yolks and pulse until incorporated.,"add,pulse"
e68daad9a9,Roll the discs of dough into thin sheets in a pasta machine.,roll
e68daad9a9,Arrange tablespoon-size dollops of the filling 1 1/2 inches apart on one of the sheets.,arrange
e68daad9a9,"Brush a little egg white around each dollop, then place another sheet directly on top.","brush,place"
e68daad9a9,Gently press around the filling to remove any air pockets and seal the sheets.,"gently press,remove,seal"
e68daad9a9,"Using a ravioli cutter or a knife, cut out ravioli squares.",cut out
e68daad9a9,Sprinkle with flour to prevent the dough from sticking.,sprinkle
e68daad9a9,"Cook the ravioli in plenty of boiling salted water until they float to the top, 3 to 4 minutes.",cook
e68daad9a9,Drain well and toss with the Fresh tomato sauce .,"drain,toss"
e68daad9a9,Garnish with the remaining chopped basil and serve immediately.,"garnish,serve"
d35d93a795,with oil brown chicken then add chinese bbq sauce and water poach chicken for 13 minute dont open lid shake pan every now and then add honet and continuevpoached for another 3 minutes,"brown,add,poach,shake,add"
d35d93a795,drain the chicken and keep sauce and put poached chicken on baking tray,"drain,put"
d35d93a795,baste with half of bbq sauce directly on chicken and bake at 200C /400F for 7 minute then baste ewth the remaining sauce for another 3 minutesTIPS******** ( separately adding sauce so the chicken is not overly soak in its sauce )***,"baste,bake,baste"
d35d93a795,"BELOW ARE FEW OF MY CHINESE BBQ SAUCE ( CHAR SIEW SAUCE ) RECIPE ,I AM GLAD TO SHARE WITH YOU",none
1f38e9e944,Brown pork chops quickly in a little fat in a heavy skillet.,brown
1f38e9e944,Sprinkle with salt and pepper.,sprinkle
1f38e9e944,"In slow cooker stir together half of the can of cherry pie filling, lemon juice, mace, and bouillon granules.Mix well.","stir,mix well"
1f38e9e944,Place pork chops on top of mixture.,place
1f38e9e944,Cover and cook on LOW for 6 to 7 hours.,"cover,cook"
1f38e9e944,Warm the other half of cherry pie filling and pass in sauce dish when serving chops.,"warm,pass"
450d61bbd4,"Fill a pan with water, a pinch of salt and a bay leaf.",fill
450d61bbd4,"Heat and when it is boiling, add the pasta and cook according to instructions on the packet.","heat,boiling,add,cook"
450d61bbd4,Saute the onions in a small amount of olive oil - just enough to prevent from sticking to the pan.,saute
450d61bbd4,Stir over a moderate heat for 5 minutes,"stir,moderate heat"
450d61bbd4,"Add a generous slosh of white wine, turn the heat up and leave to simmer until the wine is reduced (5 mins)","add,heat up,simmer"
450d61bbd4,Remove from the heat.,remove
450d61bbd4,"Add the soy cream, stir well","add,stir well"
450d61bbd4,"Put on a low heat again, and add the smoked salmon, cut into small strips","put,add,cut"
450d61bbd4,Add the dill and stir well.,"add,sitr well"
